Cites,Authors,Title,Year,Source,Publisher,ArticleURL,CitesURL,GSRank,QueryDate,Type,DOI,ISSN,CitationURL,Volume,Issue,StartPage,EndPage,ECC,CitesPerYear,CitesPerAuthor,AuthorCount,Age,Abstract
0,"SB Stulz, A Insabato, G Deco, M Gilson, M Senden","Comparing Task-Relevant Information Across Different Methods of Extracting Functional Connectivity",2018,"bioRxiv","biorxiv.org","https://www.biorxiv.org/content/10.1101/509059v1.abstract","",397,"2020-04-30 13:05:27","","","","",,,,,0,0.00,0,5,2,"The concept of brain states, functionally relevant large-scale patterns, has become popular in neuroimaging. Not all components of such patterns are equally characteristic for each brain state, but machine learning provides a possibility of extracting the structure of brain …"
0,"A Escrichs, A Sanjuan, S Atasoy…","Characterizing the dynamical complexity underlying meditation",2019,"Frontiers in systems …","frontiersin.org","https://www.frontiersin.org/articles/10.3389/fnsys.2019.00027/abstract","",398,"2020-04-30 13:05:27","","","","",,,,,0,0.00,0,4,1,"Over the past 2,500 years, contemplative traditions have explored the nature of the mind using meditation. More recently, neuroimaging research on meditation has revealed differences in brain function and structure in meditators. Nevertheless, the underlying neural …"
0,"MH Adhikari, A Griffa, P Hagmann…","Mathematical modeling for resting state functional connectivity of cortical and sub-cortical networks",2013,"BMC …","bmcneurosci.biomedcentral.com","https://bmcneurosci.biomedcentral.com/articles/10.1186/1471-2202-14-S1-P101","",399,"2020-04-30 13:05:27","","","","",,,,,0,0.00,0,4,7,"Mathematical modeling studies for brain activity at rest have mainly focused on networks of cortical areas. However, cortical areas are connected to sub-cortical areas, such as the thalamus and the hippocampus, whose contribution to the resting state activity cannot be …"
0,"ET Rolls, Y Zhou, W Cheng, M Gilson, G Deco…","Effective connectivity in autism",2020,"Autism …","Wiley Online Library","https://onlinelibrary.wiley.com/doi/abs/10.1002/aur.2235","",400,"2020-04-30 13:05:27","","","","",,,,,0,0.00,0,6,1,"The aim was to go beyond functional connectivity, by measuring in the first large‐scale study differences in effective, that is directed, connectivity between brain areas in autism compared to controls. Resting‐state functional magnetic resonance imaging was analyzed …"
0,"E Balaguer-Ballester, G Deco","Metastable Dynamics of Neural Ensembles Workshop",,"","","","",401,"2020-04-30 13:05:27","CITATION","","","",,,,,0,0.00,0,2,,""
0,"M Gilson, P Ritter, G Deco","Recovery of directed intracortical connectivity from fMRI data",2016,"AIP Conference Proceedings","aip.scitation.org","https://aip.scitation.org/doi/abs/10.1063/1.4951988","",402,"2020-04-30 13:05:27","","","","",,,,,0,0.00,0,3,4,"The brain exhibits complex spatio-temporal patterns of activity. In particular, its baseline activity at rest has a specific structure: imaging techniques (eg, fMRI, EEG and MEG) show that cortical areas experience correlated fluctuations, which is referred to as functional …"
0,"G Deco","The computational neuroscience of visual attention",2001,"","","","",403,"2020-04-30 13:05:27","CITATION","","","",,,,,0,0.00,0,1,19,""
0,"L Parra, G Deco","A stochastic network with rotor neurons",1993,"… of 1993 International Conference on Neural …","ieeexplore.ieee.org","https://ieeexplore.ieee.org/abstract/document/716805/","",404,"2020-04-30 13:05:27","","","","",,,,,0,0.00,0,2,27,"We define a new network structure to realize a continuous version of the Boltzmann machine (BM). Based on the mean field (MF) theory for continuous and multidimensional elements, named rotors (introduced by Gislen and Peterson), we derive the corresponding MF learning …"
0,"G Deco, J Ebmeyer","Artificial Neural Networks, 2 I. Aleksander and J. Taylor (Editors)© 1992 Elsevier Science Publishers BV All rights reserved. 87",1991,"Proceedings of the International Conference on …","North Holland","","",405,"2020-04-30 13:05:27","CITATION","","","",,,,,0,0.00,0,2,29,""
0,"A Hyafil, G Deco, P Fabra","Generative model estimation through Expectation-Maximization allows insight into perceptual accumulation mechanisms",,"icmns2015.inria.fr","","https://icmns2015.inria.fr/files/2015/03/Session2_icmns15_Hyafil.pdf","",406,"2020-04-30 13:05:27","PDF","","","",,,,,0,0.00,0,3,,"The mechanisms at play when the brain integrates sensory information over time to reduce uncertainty over percepts have been the focus of intensive study in the last two decades [1, 2]. Despite this effort, it has remained virtually impossible to experimentally tease apart …"
0,"G Deco, S Corchs","The role of attention in visual perception: a computational neuroscience model",2003,"Compte Rendu","Canadian Image Processing and …","","",407,"2020-04-30 13:05:27","CITATION","","","",,,,,0,0.00,0,2,17,""
0,"S Atasoy, L Roseman, M Kaelen, ML Kringelbach…","Supplementary figures for Connectome-harmonic decomposition of human brain activity reveals dynamical repertoire re-organization under LSD",,"","","","",408,"2020-04-30 13:05:27","CITATION","","","",,,,,0,0.00,0,5,,""
0,"R Silipo, G Deco, R Vergassola, C Schittenkopf…","Nonlinear modelling of the daily heart rhythm",1997,"… Conference on Artificial …","Springer","https://link.springer.com/chapter/10.1007/BFb0020297","",409,"2020-04-30 13:05:27","","","","",,,,,0,0.00,0,5,23,"A model of the Markovian character of the Heart Rate Variability (HRV) is designed by analyzing its information flow. A measure based on higher order cumulants quantifies the dependence of the current value on the past of the time series. That measure is employed as …"
0,"PF Verdes, H Stefan, G Deco…","Detection and prediction of epileptic seizures: a patient's case study",2000,"… de Ciencias de la …","sedici.unlp.edu.ar","http://sedici.unlp.edu.ar/handle/10915/23453","",410,"2020-04-30 13:05:27","","","","",,,,,0,0.00,0,4,20,"Human epilepsy is a disease characterized by sudden, unprovoked, recurrent seizures accompanied by pathological electrical activity in the brain, and is frequently resistant to drug treatment. The ability to anticipate the onset of these incapacitating episodes would …"
0,"P Triebkorn, J Zimmermann, L Stefanovski, D Roy…","Identifying optimal working points of individual Virtual Brains: A large-scale brain network modelling study",2020,"BioRxiv","biorxiv.org","https://www.biorxiv.org/content/10.1101/2020.03.26.009795v1.abstract","",411,"2020-04-30 13:05:27","","","","",,,,,0,0.00,0,5,1,"Using The Virtual Brain (TVB, thevirtualbrian. org) simulation platform, we explored for 50 individual adult human brains (ages 18-80), how personalized connectome based brain network modelling captures various empirical observations as measured by functional …"
0,"D Batallé Bolaño, E Muñoz Moreno…","Altered resting-state whole-brain functional networks of neonates with intrauterine growth restriction",2016,"Cortex, 2016, vol. 77, p …","diposit.ub.edu","http://diposit.ub.edu/dspace/handle/2445/127971","",412,"2020-04-30 13:05:27","","","","",,,,,0,0.00,0,3,4,"The feasibility to use functional MRI (fMRI) during natural sleep to assess low-frequency basal brain activity fluctuations in human neonates has been demonstrated, although its potential to characterise pathologies of prenatal origin has not yet been exploited. In the …"
0,"A Ponce-Alvarez, G Mochol, A Hermoso-Mendizabal…","Cortical state transitions and stimulus response evolve along stiff and sloppy parameter dimensions, respectively",2020,"Elife","elifesciences.org","https://elifesciences.org/articles/53268","",413,"2020-04-30 13:05:27","HTML","","","",,,,,0,0.00,0,4,1,"Previous research showed that spontaneous neuronal activity presents sloppiness: the collective behavior is strongly determined by a small number of parameter combinations, defined as 'stiff'dimensions, while it is insensitive to many others ('sloppy'dimensions). Here …"
0,"A Córdova Palomera, C Tornador, C Falcón…","Environmental factors inducing depression alter the cerebellar resting-state synchronization.",2016,"… Reports, 2016, vol. 6 …","diposit.ub.edu","http://diposit.ub.edu/dspace/handle/2445/108445","",414,"2020-04-30 13:05:27","","","","",,,,,0,0.00,0,4,4,"Hosting nearly eighty percent of all human neurons, the cerebellum is functionally connected to large regions of the brain. Accumulating data suggest that some cerebellar resting-state alterations may constitute a key candidate mechanism for depressive …"
0,"G Deco","Neural Learning of Chaotic Symbolic Sequences: A Dynamical Information Loss Analysis",1995,"Proceedings of the 1995 World Congress on Neural …","Routledge","","",415,"2020-04-30 13:05:27","CITATION","","","",,,,,0,0.00,0,1,25,""
0,"J STORCK, F JAKEL, G DECO","A model of synaptic short-term plasticity and its adaptation A model of synaptic short-term plasticity and its adaptation, 1999",1999,"ci.nii.ac.jp","","https://ci.nii.ac.jp/naid/10008965271/","",416,"2020-04-30 13:05:27","CITATION","","","",,,,,0,0.00,0,3,21,"CiNii 国立情報学研究所 学術情報ナビゲータ[サイニィ]. メニュー 検索 …"
0,"S Corchs, G Deco","Selective attention in visual search via synchronization of phase oscillators in a multimodular neural network.",2000,"JOURNAL OF COGNITIVE …","MIT PRESS FIVE CAMBRIDGE …","","",417,"2020-04-30 13:05:27","CITATION","","","",,,,,0,0.00,0,2,20,""
0,"M Vila-Vidal, C Pérez-Enríquez, A Principe…","Low entropy map of brain oscillatory activity identifies spatially localized events",2020,"… . 2020 Mar; 208 …","repositori.upf.edu","https://repositori.upf.edu/handle/10230/43657","",418,"2020-04-30 13:05:27","","","","",,,,,0,0.00,0,4,1,"The spatial mapping of localized events in brain activity critically depends on the correct identification of the pattern signatures associated with those events. For instance, in the context of epilepsy research, a number of different electrophysiological patterns have been …"
0,"J Braun, G Deco, A Pastukhov","Constraining the dynamics of multi-stable perception",2013,"Journal of …","The Association for Research in …","","",419,"2020-04-30 13:05:27","CITATION","","","",,,,,0,0.00,0,3,7,""
0,"ET Rolls, G Deco, R Shapley","Book review-//The roles of computation and experiment in neuroscience-Computational Neuroscience of Vision",2002,"Nature …","New York, NY: Nature America Inc …","","",420,"2020-04-30 13:05:27","CITATION","","","",,,,,0,0.00,0,3,18,""
0,"G Deco, B Schürmann","Applications: Nonparametric Characterization of Time Series",2001,"Information Dynamics","Springer","https://link.springer.com/chapter/10.1007/978-1-4613-0127-1_6","",421,"2020-04-30 13:05:27","","","","",,,,,0,0.00,0,2,19,"In this chapter, we present various applications of our methods for nonparametric characterization of dynamical systems. In Section 6.1, we concentrate on detecting the existence of nonlinear correlations in time series and the predictability of the system. As a …"
0,"R Hindriks, C Micheli, C Bosman, R Oostenveld…","Reconstruction of resting-state networks from macaque electrocorticographic data",2017,"bioRxiv","biorxiv.org","https://www.biorxiv.org/content/10.1101/221051v1.abstract","",422,"2020-04-30 13:05:27","","","","",,,,,0,0.00,0,5,3,"The discovery of haemodynamic (BOLD-fMRI) resting-state networks (RSNs) has brought about a fundamental shift in our thinking about the role of intrinsic brain activity. The electrophysiological underpinnings of RSNs remain largely elusive and it has been shown …"
0,"G Deco, J Zihl","A Neuronal Model of Binding and Selective",2012,"… Models in Cognitive Neuroscience: The 5th …","books.google.com","https://books.google.com/books?hl=en&lr=&id=iGzjBwAAQBAJ&oi=fnd&pg=PA262&dq=%22gustavo+deco%22&ots=cFK4taHF8D&sig=nNHzLED-IpMSO2NIqbKgrR4EFBo","",423,"2020-04-30 13:05:27","","","","",,,,,0,0.00,0,2,8,"In the present work we hypothesize that the different slopes observed in visual search experiments can be explained by assuming that selective attention is guided by independent mechanism which corresponds to the independent search in each feature …"
0,"G Deco, D Obradovic","Nonlinear Feature Extraction: Boolean Stochastic Networks",1996,"An Information-Theoretic Approach to Neural …","Springer","https://link.springer.com/chapter/10.1007/978-1-4612-4016-7_5","",424,"2020-04-30 13:05:27","","","","",,,,,0,0.00,0,2,24,"The previous two chapters presented the PCA related problems of independent feature extraction and information maximization within linear networks. The extension to nonlinear networks is discussed in Chapter 5 and Chapter 6. The simplest nonlinear networks where …"
0,"G Deco, B Schürmann","Information Processing and Coding in Spatiotemporal Dynamical Systems: Spiking Networks",2001,"Information Dynamics","Springer","https://link.springer.com/chapter/10.1007/978-1-4613-0127-1_9","",425,"2020-04-30 13:05:27","","","","",,,,,0,0.00,0,2,19,"One of the most exciting challenges in theoretical neurobiology is the question of how the information is carried in the brain and why it is carried in this way and not in others (ie, the question of which first principles guide the neural processing of information and knowledge) …"
0,"G Ódor, J Kelling, G Deco","The effect of noise on the synchronization dynamics of the Kuramoto model on a large human connectome graph",2019,"arXiv preprint arXiv:1912.06018","arxiv.org","https://arxiv.org/abs/1912.06018","",426,"2020-04-30 13:05:27","","","","",,,,,0,0.00,0,3,1,"We have extended the study of the Kuramoto model with additive Gaussian noise running on the {\it KKI-18} large human connectome graph. We determined the dynamical behavior of this model by solving it numerically in an assumed homeostatic state, below the …"
0,"A Hutt, V Jirsa, J Terry, W Erlhagen, R Moreno-Bote…","CNS 2013 Paris: Tutorials Program",,"cnsorg.org","","https://www.cnsorg.org/cns-2013-tutorials","",427,"2020-04-30 13:05:27","HTML","","","",,,,,0,0.00,0,6,,"The brain exhibits dynamical processes on different spatial and temporal scales. Single neurons have a size of tens of micrometers and fire during few milliseconds, whereas macroscopic brain activity, such as encephalographic data or the BOLD response in …"
0,"G Deco, D Obradovic","Linear Feature Extraction: Infomax Principle",1996,"An Information-Theoretic Approach to Neural …","Springer","https://link.springer.com/chapter/10.1007/978-1-4612-4016-7_3","",428,"2020-04-30 13:05:27","","","","",,,,,0,0.00,0,2,24,"Feature extraction is one of the principal goals of unsupervised learning. In biological systems it is the first step of the cognitive mechanism that enables processing of the higher order cognitive functions. Chapter 3 and Chapter 4 focus on the case of linear feature …"
0,"R Hindriks, G Deco, F Bijma, P Spreij","Model Fitting and Parameter Estimation of Neural Mass Models Stefano Baruch Blumberg Vrije Universiteit Amsterdam and Universiteit van Amsterdam",,"beta.vu.nl","","https://beta.vu.nl/nl/Images/stageverslag-blumberg_tcm235-457295.pdf","",429,"2020-04-30 13:05:27","PDF","","","",,,,,0,0.00,0,4,,"It is hard to overemphasise how important brains are for humans-as an organ it is central to our lives and experiences. Attempting to understand the patterns and relationships concerning the voltage fluctuations between different neurons in the brain has been a long …"
0,"M Gilson, G Zamora-López, V Pallarés…","MOU-EC: model-based whole-brain effective connectivity to extract biomarkers for brain dynamics from fMRI data and study distributed cognition",2019,"…","repository.uantwerpen.be","https://repository.uantwerpen.be/docman/irua/fa882f/163542.pdf","",430,"2020-04-30 13:05:27","PDF","","","",,,,,0,0.00,0,4,1,"Neuroimaging techniques are increasingly used to study brain cognition in humans. Beyond their individual activation, the functional associations between brain areas have become a standard proxy to describe how information is distributed across the brain network. Among …"
0,"G Deco, J Zihl","A neurodynamical approach to visual attention",2000,"Advances in Neural Information Processing Systems","papers.nips.cc","http://papers.nips.cc/paper/1751-a-neurodynamical-approach-to-visual-attention.pdf","",431,"2020-04-30 13:05:27","PDF","","","",,,,,0,0.00,0,2,20,"The psychophysical evidence for"" selective attention"" originates mainly from visual search experiments. In this work, we formulate a hierarchical system of interconnected modules consisting in populations of neurons for modeling the underlying mechanisms involved in …"
0,"JA Galadi, SS Pereira, YS Perl, ML Kringelbach…","Dynamical informational structures characterize the different human brain states of wakefulness and deep sleep",2019,"bioRxiv","biorxiv.org","https://www.biorxiv.org/content/10.1101/846667v1.abstract","",432,"2020-04-30 13:05:27","","","","",,,,,0,0.00,0,5,1,"The dynamical activity of the human brain describes an extremely complex energy landscape changing over time and its characterisation is central unsolved problem in neuroscience. We propose a novel mathematical formalism for characterizing how the …"
0,"G Deco, VK Jirsa, AR McIntosh","Resting Brains Never Rest: Computational Insights into Potential Cognitive Architectures:(Trends in Neurosciences 36, 268–274, 2013)",2018,"Trends in neurosciences","cell.com","https://www.cell.com/trends/neurosciences/fulltext/S0166-2236(17)30252-7","",433,"2020-04-30 13:05:27","","","","",,,,,0,0.00,0,3,2,"Interest in the interplay between the intrinsic activity of the brain and the external world has seen a revival over the past decade, especially in neuroimaging. An assumption in many of the early studies was that such intrinsic brain activity is irrelevant and sufficiently random that it averages …"
0,"N Padilla, VM Saenger, TJ van Hartevelt…","Breakdown of Whole-brain Dynamics in Preterm-born Children",2020,"Cerebral …","academic.oup.com","https://academic.oup.com/cercor/article-abstract/30/3/1159/5548928","",434,"2020-04-30 13:05:27","","","","",,,,,0,0.00,0,4,1,"The brain operates at a critical point that is balanced between order and disorder. Even during rest, unstable periods of random behavior are interspersed with stable periods of balanced activity patterns that support optimal information processing. Being born preterm …"
0,"M Vila-Vidal, K Capouskova, S Atasoy…","Uncovering the spatiotemporal scales of common neuro-mental constructs: Comment on"" Is temporo-spatial dynamics the'common currency'of brain and mind? In …",2019,"Physics of life …","ncbi.nlm.nih.gov","https://www.ncbi.nlm.nih.gov/pubmed/31706923","",435,"2020-04-30 13:05:27","","","","",,,,,0,0.00,0,4,1,"Author information: (1)Center for Brain and Cognition, Universitat Pompeu Fabra, Barcelona, Spain. Electronic address: m@vila-vidal.com. (2)Center for Brain and Cognition, Universitat Pompeu Fabra, Barcelona, Spain. (3)Department of Psychiatry, University of Oxford, Oxford, UK. (4)Department …"
0,"G Deco, ET Rolls","A Computational Neuroscience Approach to Visual Cognition, Attention, and Working Memory",,"","","","",436,"2020-04-30 13:05:27","CITATION","","","",,,,,0,0.00,0,2,,""
0,"CA Figueroa, J Cabral, RJT Mocking, KM Rapuano…","Decreased ability to access a clinically relevant control network in patients remitted from Major Depressive Disorder",,"pdfs.semanticscholar.org","","https://pdfs.semanticscholar.org/4ac4/0fa609819bbf023b16c0a2e5d00037bb0724.pdf","",437,"2020-04-30 13:05:27","PDF","","","",,,,,0,0.00,0,5,,"Neurobiological models to explain vulnerability of Major Depressive Disorder (MDD) are scarce and previous fMRI studies mostly examined 'static'functional connectivity (FC). Knowing that FC constantly evolves over time, it becomes important to assess how FC …"
0,"G Deco, D Obradovic","Preliminaries of Information Theory and Neural Networks",1996,"An Information-Theoretic Approach to Neural …","Springer","https://link.springer.com/content/pdf/10.1007/978-1-4612-4016-7_2.pdf","",438,"2020-04-30 13:05:27","","","","",,,,,0,0.00,0,2,24,"There are two distinctive parts of this chapter. The first part introduces basic definitions and theorems of infonnation theory required for the subsequent development of the statistics-based theory of neural networks. Three basic concepts of infonnation theory: entropy, relative infonnation and …"
0,"C Schittenkopf, G Deco","Detecting non-linear dynamics in financial time series",1997,"Proceedings of the IEEE/IAFE 1997 …","ieeexplore.ieee.org","https://ieeexplore.ieee.org/abstract/document/618950/","",439,"2020-04-30 13:05:27","","","","",,,,,0,0.00,0,2,23,"Characterizes a given dynamical system in the sense that the order of the Markov process which approximates its statistical dependencies appropriately, is determined. Our method measures the information flow of the dynamics indirectly via higher-order cumulants …"
0,"J Storck, G Deco","Spike-Based Hebbian Learning for Stimulus Discrimination",1998,"International Conference on Artificial Neural Networks","Springer","https://link.springer.com/chapter/10.1007/978-1-4471-1599-1_166","",440,"2020-04-30 13:05:27","","","","",,,,,0,0.00,0,2,22,"We analyse the impact of Hebbian Learning on a network of spiking neurons. The network consists of pyramidal cells each of which is connected to other pyramidal cells and also locally to an inhibitory stellate cell. The neurons are described by the spike response model …"
0,"HM Fernandes, J Cabral, TJ Van Hartevelt, LD Lord…","Disrupted brain structural connectivity in Pediatric Bipolar Disorder with psychosis",2019,"Scientific reports","nature.com","https://www.nature.com/articles/s41598-019-50093-4","",441,"2020-04-30 13:05:27","HTML","","","",,,,,0,0.00,0,5,1,"Bipolar disorder (BD) has been linked to disrupted structural and functional connectivity between prefrontal networks and limbic brain regions. Studies of patients with pediatric bipolar disorder (PBD) can help elucidate the developmental origins of altered structural …"
0,"M Demirtas, A Ponce-Alvarez, M Gilson, P Hagmann…","Distinct Functional Connectivity Mode during Viewing Natural Scenes Revealed by Principal Component Analysis",2018,"bioRxiv","biorxiv.org","https://www.biorxiv.org/content/10.1101/286484v1.abstract","",442,"2020-04-30 13:05:27","","","","",,,,,0,0.00,0,5,2,"A fundamental question in systems neuroscience is how spontaneous activity at rest is reorganized during task performance. Recent studies suggest a strong relationship between resting and task FC. Furthermore, the relationship between resting and task FC has been …"
0,"M Demirtas, M Gilson, JD Murray, D Popovic, E Vieta…","Exploring Anti-correlated Resting State BOLD Signals Through Dynamic Functional Connectivity and Whole-brain Computational Modeling",2016,"bioRxiv","biorxiv.org","https://www.biorxiv.org/content/10.1101/085274v1.abstract","",443,"2020-04-30 13:05:27","","","","",,,,,0,0.00,0,6,4,"Resting-state functional magnetic resonance imaging and diffusion weight imaging became a conventional tool to study brain connectivity in healthy and diseased individuals. However, both techniques provide indirect measures of brain connectivity leading to controversies on …"
0,"ML Kringelbach, G Deco","Whole-brain modeling of neuroimaging data: Moving beyond correlation to causation",2019,"Casting Light on the Dark Side of Brain Imaging","Elsevier","https://www.sciencedirect.com/science/article/pii/B9780128161791000244","",444,"2020-04-30 13:05:27","","","","",,,,,0,0.00,0,2,1,"Neuroimaging has offered an unprecedented window on human brain activity. While this advance has led to great expectations, many neuroscientists have grown increasingly frustrated with the lack of causal insights that this technique has provided into human brain …"
0,"AM Marca, G Deco, I Cos","Rapid Online Changes of Mind during Value-based Action Decisions",2019,"bioRxiv","biorxiv.org","https://www.biorxiv.org/content/10.1101/656330v1.abstract","",445,"2020-04-30 13:05:27","","","","",,,,,0,0.00,0,3,1,"While the principles of decision-making are often expressed in terms of benefit-cost trade-off, reasonable doubt remains as to how the cognitive value and motor cost associated to several options may be computed across several brain areas, ultimately leading to a …"
0,"G Deco, B Schurmann, J Storck","Method for classifying the traffic dynamism of a network communication using a network that contains pulsed neurons, neuronal network and system for carrying out …",2005,"US Patent App. 10/503,626","Google Patents","https://patents.google.com/patent/US20050105463A1/en","",446,"2020-04-30 13:05:27","","","","",,,,,0,0.00,0,3,15,"A method classifies the traffic dynamism of a network communication using a network that contains pulsed neurons. Traffic data of the network communication are used as the input variables of the neuronal network. Temporal clusters obtained by processing the pulses are …"
0,"VM Saenger Amoore, J Kahan, T Foltynie…","Uncovering the underlying mechanisms and whole-brain dynamics of deep brain stimulation for Parkinson's disease",2017,"… Reports. 2017 Aug …","repositori.upf.edu","https://repositori.upf.edu/handle/10230/37092","",447,"2020-04-30 13:05:27","","","","",,,,,0,0.00,0,4,3,"Deep brain stimulation (DBS) for Parkinson's disease is a highly effective treatment in controlling otherwise debilitating symptoms. Yet the underlying brain mechanisms are currently not well understood. Whole-brain computational modeling was used to disclose the …"
