Cites,Authors,Title,Year,Source,Publisher,ArticleURL,CitesURL,GSRank,QueryDate,Type,DOI,ISSN,CitationURL,Volume,Issue,StartPage,EndPage,ECC,CitesPerYear,CitesPerAuthor,AuthorCount,Age,Abstract
11,"A Insabato, L Dempere-Marco, M Pannunzi…","The influence of spatiotemporal structure of noisy stimuli in decision making",2014,"PLOS computational …","ncbi.nlm.nih.gov","https://www.ncbi.nlm.nih.gov/pmc/articles/PMC3990472/","https://scholar.google.com/scholar?cites=3956996847655215797&as_sdt=2005&sciodt=0,5&hl=en",234,"2020-04-30 13:05:27","HTML","","","",,,,,11,1.83,3,4,6,"Decision making is a process of utmost importance in our daily lives, the study of which has been receiving notable attention for decades. Nevertheless, the neural mechanisms underlying decision making are still not fully understood. Computational modeling has …"
11,"M Szabo, R Almeida, G Deco, M Stetter","A neuronal model for the shaping of feature selectivity in IT by visual categorization",2005,"Neurocomputing","Elsevier","https://www.sciencedirect.com/science/article/pii/S0925231204003923","https://scholar.google.com/scholar?cites=18202558432461758519&as_sdt=2005&sciodt=0,5&hl=en",235,"2020-04-30 13:05:27","","","","",,,,,11,0.73,3,4,15,"Neurophysiology results have shown that learning a visual categorization task shapes the selectivity of inferiotemporal cortex neurons to task-relevant features of the stimuli. In this work, we propose a biologically realistic mean-field neuronal model of a two-layer network …"
10,"D Obradovic, G Deco","An information theory based learning paradigm for linear feature extraction",1996,"Neurocomputing","Elsevier","https://www.sciencedirect.com/science/article/pii/0925231295001190","https://scholar.google.com/scholar?cites=5620608742265206045&as_sdt=2005&sciodt=0,5&hl=en",236,"2020-04-30 13:05:27","","","","",,,,,10,0.42,5,2,24,"This paper presents a novel unsupervised learning paradigm for feature extraction in linear networks under the constraint that no information distortion occurs in the input-output map. Independent feature extraction is then accomplished by minimizing an appropriate …"
10,"JM Abolafia, M Martinez-Garcia, G Deco…","Variability and information content in auditory cortex spike trains during an interval-discrimination task",2013,"Journal of …","physiology.org","https://www.physiology.org/doi/abs/10.1152/jn.00381.2013","https://scholar.google.com/scholar?cites=7624352058982347097&as_sdt=2005&sciodt=0,5&hl=en",237,"2020-04-30 13:05:27","","","","",,,,,10,1.43,3,4,7,"Processing of temporal information is key in auditory processing. In this study, we recorded single-unit activity from rat auditory cortex while they performed an interval-discrimination task. The animals had to decide whether two auditory stimuli were separated by either 150 …"
11,"A Vattikonda, BR Surampudi, A Banerjee, G Deco…","Does the regulation of local excitation–inhibition balance aid in recovery of functional connectivity? A computational account",2016,"Neuroimage","Elsevier","https://www.sciencedirect.com/science/article/pii/S1053811916301161","https://scholar.google.com/scholar?cites=8112874258749786885&as_sdt=2005&sciodt=0,5&hl=en",238,"2020-04-30 13:05:27","","","","",,,,,11,2.75,2,5,4,"Computational modeling of the spontaneous dynamics over the whole brain provides critical insight into the spatiotemporal organization of brain dynamics at multiple resolutions and their alteration to changes in brain structure (eg in diseased states, aging, across …"
10,"J Storck, G Deco","Nonlinear independent component analysis and multivariate time series analysis",1997,"Physica D: Nonlinear Phenomena","Elsevier","https://www.sciencedirect.com/science/article/pii/S0167278997000109","https://scholar.google.com/scholar?cites=8794346442238213223&as_sdt=2005&sciodt=0,5&hl=en",239,"2020-04-30 13:05:27","","","","",,,,,10,0.43,5,2,23,"We derive an information-theory-based unsupervised learning paradigm for nonlinear independent component analysis (NICA) with neural networks. We demonstrate that under the constraint of bounded and invertible output transfer functions the two main goals of …"
10,"A Córdova‐Palomera, C Tornador…","Altered amygdalar resting‐state connectivity in depression is explained by both genes and environment",2015,"Human brain …","Wiley Online Library","https://onlinelibrary.wiley.com/doi/abs/10.1002/hbm.22876","https://scholar.google.com/scholar?cites=11867729914412550410&as_sdt=2005&sciodt=0,5&hl=en",240,"2020-04-30 13:05:27","","","","",,,,,10,2.00,3,3,5,"Recent findings indicate that alterations of the amygdalar resting‐state fMRI connectivity play an important role in the etiology of depression. While both depression and resting‐state brain activity are shaped by genes and environment, the relative contribution of genetic and …"
12,"R Hindriks, XD Arsiwalla…","Discrepancies between multi-electrode LFP and CSD phase-patterns: a forward modeling study",2016,"Frontiers in neural …","frontiersin.org","https://www.frontiersin.org/articles/10.3389/fncir.2016.00051","https://scholar.google.com/scholar?cites=2398595313471169476&as_sdt=2005&sciodt=0,5&hl=en",241,"2020-04-30 13:05:27","HTML","","","",,,,,12,3.00,4,3,4,"Multi-electrode recordings of local field potentials (LFP's) provide the opportunity to investigate the spatiotemporal organization of neural activity on the scale of several millimeters. In particular, the phases of oscillatory LFP's allow studying the coordination of …"
10,"G Deco, LJ Dubé","Arrangement for predicting an abnormality of a system and for carrying out an action which counteracts the abnormality",2006,"US Patent 7,006,866","Google Patents","https://patents.google.com/patent/US7006866B1/en","https://scholar.google.com/scholar?cites=10680251614754858695&as_sdt=2005&sciodt=0,5&hl=en",242,"2020-04-30 13:05:27","","","","",,,,,10,0.71,5,2,14,"An arrangement and method are presented that enable a prediction of an abnormality and implement a suitable action opposing the abnormality. An information flow underlying a dynamic system is interpreted and a prediction quantity that comprises the abnormality as …"
10,"A Daffertshofer, R Ton, ML Kringelbach, M Woolrich…","Distinct criticality of phase and amplitude dynamics in the resting brain",2018,"Neuroimage","Elsevier","https://www.sciencedirect.com/science/article/pii/S1053811918301873","https://scholar.google.com/scholar?cites=9341035242973606799&as_sdt=2005&sciodt=0,5&hl=en",243,"2020-04-30 13:05:27","HTML","","","",,,,,10,5.00,2,5,2,"Converging research suggests that the resting brain operates at the cusp of dynamic instability, as signified by scale-free temporal correlations. We asked whether the scaling properties of these correlations differ between amplitude and phase fluctuations, which may …"
9,"M Goldbach, M Loh, G Deco, J Garcia-Ojalvo","Neurodynamical amplification of perceptual signals via system-size resonance",2008,"Physica D: Nonlinear …","Elsevier","https://www.sciencedirect.com/science/article/pii/S0167278907003302","https://scholar.google.com/scholar?cites=6202685700660687081&as_sdt=2005&sciodt=0,5&hl=en",244,"2020-04-30 13:05:27","","","","",,,,,9,0.75,2,4,12,"We study the effect of finite-size synaptic noise on the response to time-varying stimuli of a detailed neurodynamical model of perceptual-decision making. Specifically, the reaction to a periodic stimulus is analyzed, while controlling the noise level through the number of …"
9,"G Deco","The computational neuroscience of visual cognition: Attention, memory and reward",2004,"International Workshop on Attention and Performance …","Springer","https://link.springer.com/chapter/10.1007/978-3-540-30572-9_8","https://scholar.google.com/scholar?cites=7244423159246801353&as_sdt=2005&sciodt=0,5&hl=en",245,"2020-04-30 13:05:27","","","","",,,,,9,0.56,9,1,16,"Cognitive behaviour requires complex context-dependent processing of information that emerges from the links between attentional perceptual processes, working memory and reward-based evaluation of the performed actions. We describe a computational …"
9,"S Corchs, M Stetter, G Deco","Systems-level neuronal modeling of visual attentional mechanisms",2003,"Artificial Intelligence Review","Springer","https://link.springer.com/article/10.1023/A:1026028429257","https://scholar.google.com/scholar?cites=15845190982591251006&as_sdt=2005&sciodt=0,5&hl=en",246,"2020-04-30 13:05:27","","","","",,,,,9,0.53,3,3,17,"We review different functions involved in visual perception that have been integrated by a model based on the biased competition hypothesis. Attentional top-down bias guides the dynamics to concentrate at a given spatial location or on given features. The model …"
9,"G Deco","Universitat Pompeu Fabra",,"Spain","","","https://scholar.google.com/scholar?cites=5139144476620424789&as_sdt=2005&sciodt=0,5&hl=en",247,"2020-04-30 13:05:27","CITATION","","","",,,,,9,0.00,9,1,,""
9,"L Paz, A Insabato, A Zylberberg, G Deco, M Sigman","Confidence through consensus: a neural mechanism for uncertainty monitoring",2016,"Scientific reports","nature.com","https://www.nature.com/articles/srep21830","https://scholar.google.com/scholar?cites=9295382302024923652&as_sdt=2005&sciodt=0,5&hl=en",248,"2020-04-30 13:05:27","HTML","","","",,,,,9,2.25,2,5,4,"Abstract Models that integrate sensory evidence to a threshold can explain task accuracy, response times and confidence, yet it is still unclear how confidence is encoded in the brain. Classic models assume that confidence is encoded in some form of balance between the …"
9,"G Deco, M Stetter, M Szabo","Method for computer-aided learning of a neural network and neural network",2013,"US Patent 8,423,490","Google Patents","https://patents.google.com/patent/US8423490B2/en","https://scholar.google.com/scholar?cites=15886895678385453411&as_sdt=2005&sciodt=0,5&hl=en",249,"2020-04-30 13:05:27","","","","",,,,,9,1.29,3,3,7,"There is described a method for computer-aided learning of a neural network, with a plurality of neurons in which the neurons of the neural network are divided into at least two layers, comprising a first layer and a second layer crosslinked with the first layer. In the first layer …"
9,"G Deco, L Parra","Unsupervised learning for Boltzman machines",1995,"Network: Computation in Neural Systems","Taylor & Francis","https://www.tandfonline.com/doi/abs/10.1088/0954-898X_6_3_009","https://scholar.google.com/scholar?cites=9664927001737352673&as_sdt=2005&sciodt=0,5&hl=en",250,"2020-04-30 13:05:27","","","","",,,,,9,0.36,5,2,25,"An unsupervised learning algorithm for a stochastic recurrent neural network based on the Boltzmann Machine architecture is formulated in this paper. The maximization of the mutual information between the stochastic output neurons and the clamped inputs is used as an …"
9,"L Parra, G Deco","Continuous Boltzmann machine with rotor neurons",1995,"Neural Networks","Elsevier","https://www.sciencedirect.com/science/article/pii/089360809400074V","https://scholar.google.com/scholar?cites=1351194798898915836&as_sdt=2005&sciodt=0,5&hl=en",251,"2020-04-30 13:05:27","","","","",,,,,9,0.36,5,2,25,"We define a new network structure to realize a continuous version of the Boltzmann machine (BM). Based on mean field (MF) theory for continuous and multidimensional elements named “rotors,” we derive the corresponding MF learning algorithm. Simulations …"
8,"GR Deco, RD Rivarola","Two-center effects in relativistic radiative electron capture",1989,"Physical Review A","APS","https://journals.aps.org/pra/abstract/10.1103/PhysRevA.39.5451","https://scholar.google.com/scholar?cites=13999549687948932557&as_sdt=2005&sciodt=0,5&hl=en",252,"2020-04-30 13:05:27","","","","",,,,,8,0.26,4,2,31,"Radiative electron capture in relativistic ion-atom collisions is studied by describing the ''active''electron in the combined field of the target and projectile. This two-center effect introduces important changes in the radiative recombination process at very high impact …"
8,"G Deco, J Zihl","A Neuronal Model of Binding and Selective Attention for Visual Search",1999,"Connectionist Models in Cognitive Neuroscience","Springer","https://link.springer.com/chapter/10.1007/978-1-4471-0813-9_23","https://scholar.google.com/scholar?cites=13934137032404463828&as_sdt=2005&sciodt=0,5&hl=en",253,"2020-04-30 13:05:27","","","","",,,,,8,0.38,4,2,21,"In the present work we hypothesize that the different slopes observed in visual search experiments can be explained by assuming that selective attention is guided by independent mechanism which corresponds to the independent search in each feature …"
8,"G Deco, D Obradovic","Independent Component Analysis: General Formulation and Linear Case",1996,"An Information-theoretic Approach to Neural …","Springer","https://link.springer.com/chapter/10.1007/978-1-4612-4016-7_4","https://scholar.google.com/scholar?cites=10832686829848789324&as_sdt=2005&sciodt=0,5&hl=en",254,"2020-04-30 13:05:27","","","","",,,,,8,0.33,4,2,24,"This chapter formulates the problem of Independent Component Analysis (ICA) as a search for an information-preserving linear mapping which results in statistically independent output components. The mathematical tools used herein originate from information theory and …"
8,"G Deco, B Schürmann","Dynamic modeling of chaotic time series by neural networks",1997,"… learning theory and natural learning systems …","dl.acm.org","https://dl.acm.org/doi/abs/10.5555/267553.267562","https://scholar.google.com/scholar?cites=8210625166561333168&as_sdt=2005&sciodt=0,5&hl=en",255,"2020-04-30 13:05:27","CITATION","","","",,,,,8,0.35,4,2,23,""
9,"G Deco, J Cruzat, ML Kringelbach","Brain songs framework used for discovering the relevant timescale of the human brain",2019,"Nature communications","nature.com","https://www.nature.com/articles/s41467-018-08186-7","https://scholar.google.com/scholar?cites=7935867983007701147&as_sdt=2005&sciodt=0,5&hl=en",256,"2020-04-30 13:05:27","HTML","","","",,,,,9,9.00,3,3,1,"A key unresolved problem in neuroscience is to determine the relevant timescale for understanding spatiotemporal dynamics across the whole brain. While resting state fMRI reveals networks at an ultraslow timescale (below 0.1 Hz), other neuroimaging modalities …"
8,"G Deco, C Schittenkopf","Method for classifying a time series, that includes a prescribable plurality of samples, with a computer",2001,"US Patent 6,226,549","Google Patents","https://patents.google.com/patent/US6226549B1/en","https://scholar.google.com/scholar?cites=10059687525821689357&as_sdt=2005&sciodt=0,5&hl=en",257,"2020-04-30 13:05:27","","","","",,,,,8,0.42,4,2,19,"A method for classifying a time series, that includes a prescribable plurality of samples, with a computer wherein generalized correlation integral is determined for at least a part of samples of a time series. A functions family of an entropy function is determined from the …"
8,"G Deco, J Zihl","Neurodynamical mechanism of binding and selective attention for visual search",2000,"Neurocomputing","Elsevier","https://www.sciencedirect.com/science/article/pii/S0925231200002344","https://scholar.google.com/scholar?cites=17462104952758676608&as_sdt=2005&sciodt=0,5&hl=en",258,"2020-04-30 13:05:27","","","","",,,,,8,0.40,4,2,20,"We propose a system of interconnected modules consisting in populations of neurons for modeling the underlying mechanisms involved in selective visual attention. We demonstrate that it is plausible to build a neural system for visual search, which works across the visual …"
8,"TI Panagiotaropoulos, V Kapoor, NK Logothetis…","A common neurodynamical mechanism could mediate externally induced and intrinsically generated transitions in visual awareness",2013,"PloS one","ncbi.nlm.nih.gov","https://www.ncbi.nlm.nih.gov/pmc/articles/PMC3547944/","https://scholar.google.com/scholar?cites=6474922411726375162&as_sdt=2005&sciodt=0,5&hl=en",259,"2020-04-30 13:05:27","HTML","","","",,,,,8,1.14,2,4,7,"The neural correlates of conscious visual perception are commonly studied in paradigms of perceptual multistability that allow multiple perceptual interpretations during unchanged sensory stimulation. What is the source of this multistability in the content of perception …"
9,"M Demirtaş, A Ponce-Alvarez, M Gilson, P Hagmann…","Distinct modes of functional connectivity induced by movie-watching",2019,"NeuroImage","Elsevier","https://www.sciencedirect.com/science/article/pii/S1053811918308279","https://scholar.google.com/scholar?cites=4951814085542052246&as_sdt=2005&sciodt=0,5&hl=en",260,"2020-04-30 13:05:27","","","","",,,,,9,9.00,2,5,1,"A fundamental question in systems neuroscience is how endogenous neuronal activity self-organizes during particular brain states. Recent neuroimaging studies have demonstrated systematic relationships between resting-state and task-induced functional connectivity (FC) …"
18,"F Grabenhorst, R Báez-Mendoza, W Genest, G Deco…","Primate amygdala neurons simulate decision processes of social partners",2019,"Cell","Elsevier","https://www.sciencedirect.com/science/article/pii/S0092867419302259","https://scholar.google.com/scholar?cites=3832777876113449452&as_sdt=2005&sciodt=0,5&hl=en",261,"2020-04-30 13:05:27","HTML","","","",,,,,18,18.00,4,5,1,"By observing their social partners, primates learn about reward values of objects. Here, we show that monkeys' amygdala neurons derive object values from observation and use these values to simulate a partner monkey's decision process. While monkeys alternated making …"
8,"M Pannunzi, G Gigante, M Mattia, G Deco…","Learning selective top-down control enhances performance in a visual categorization task",2012,"Journal of …","physiology.org","https://www.physiology.org/doi/abs/10.1152/jn.00208.2012","https://scholar.google.com/scholar?cites=7078630063635940971&as_sdt=2005&sciodt=0,5&hl=en",262,"2020-04-30 13:05:27","","","","",,,,,8,1.00,2,5,8,"We model the putative neuronal and synaptic mechanisms involved in learning a visual categorization task, taking inspiration from single-cell recordings in inferior temporal cortex (ITC). Our working hypothesis is that learning the categorization task involves both bottom …"
9,"JM Abolafia, M Martinez-Garcia, G Deco…","Slow modulation of ongoing discharge in the auditory cortex during an interval-discrimination task",2011,"Frontiers in integrative …","frontiersin.org","https://www.frontiersin.org/articles/10.3389/fnint.2011.00060","https://scholar.google.com/scholar?cites=15909724385326541261&as_sdt=2005&sciodt=0,5&hl=en",263,"2020-04-30 13:05:27","HTML","","","",,,,,9,1.00,2,4,9,"In this study, we recorded the single unit activity from rat auditory cortex while the animals performed an interval-discrimination task. The animals had to decide whether two auditory stimuli were separated by either 150 or 300 ms, and go to the left or right nose-poke …"
8,"K Glomb, A Ponce-Alvarez, M Gilson, P Ritter, G Deco","Stereotypical modulations in dynamic functional connectivity explained by changes in BOLD variance",2018,"NeuroImage","Elsevier","https://www.sciencedirect.com/science/article/pii/S1053811917310984","https://scholar.google.com/scholar?cites=7352167911416372960&as_sdt=2005&sciodt=0,5&hl=en",264,"2020-04-30 13:05:27","","","","",,,,,8,4.00,2,5,2,"Spontaneous activity measured in human subject under the absence of any task exhibits complex patterns of correlation that largely correspond to large-scale functional topographies obtained with a wide variety of cognitive and perceptual tasks. These “resting …"
8,"A Insabato, M Pannunzi, G Deco","Neural correlates of metacognition: A critical perspective on current tasks",2016,"Neuroscience & Biobehavioral Reviews","Elsevier","https://www.sciencedirect.com/science/article/pii/S0149763416302950","https://scholar.google.com/scholar?cites=8847856510334090080&as_sdt=2005&sciodt=0,5&hl=en",265,"2020-04-30 13:05:27","","","","",,,,,8,2.00,3,3,4,"Humans have a remarkable ability to reflect upon their behavior and mental processes, a capacity known as metacognition. Recent neurophysiological experiments have attempted to elucidate the neural correlates of metacognition in other species. Despite this increased …"
11,"H Palma-Gudiel, A Córdova-Palomera…","Increased methylation at an unexplored glucocorticoid responsive element within exon 1D of NR3C1 gene is related to anxious-depressive disorders and decreased …",2018,"European …","Elsevier","https://www.sciencedirect.com/science/article/pii/S0924977X18300919","https://scholar.google.com/scholar?cites=15417299048736223412&as_sdt=2005&sciodt=0,5&hl=en",266,"2020-04-30 13:05:27","","","","",,,,,11,5.50,4,3,2,"Among the major psychiatric disorders, anxious-depressive disorders stand out as one of the more prevalent and more frequently associated with hypothalamic-pituitary-adrenal (HPA) axis abnormalities. Methylation at the exon 1 F of the glucocorticoid receptor gene …"
6,"D Martí, G Deco, P Del Giudice, M Mattia","Reward-biased probabilistic decision-making: mean-field predictions and spiking simulations",2006,"Neurocomputing","Elsevier","https://www.sciencedirect.com/science/article/pii/S0925231205003954","https://scholar.google.com/scholar?cites=4159162582343291971&as_sdt=2005&sciodt=0,5&hl=en",267,"2020-04-30 13:05:27","","","","",,,,,6,0.43,2,4,14,"In this work we study the basic competitive and cooperative mechanisms of neural activity in the context of a two-alternative free-choice eye-movement task, as a function of the expectation of reward. We use a simplified version of the protocol followed by Platt and …"
9,"M Vila-Vidal, A Principe, M Ley, G Deco…","Detection of recurrent activation patterns across focal seizures: Application to seizure onset zone identification",2017,"Clinical …","Elsevier","https://www.sciencedirect.com/science/article/pii/S1388245717301372","https://scholar.google.com/scholar?cites=15432556634406161698&as_sdt=2005&sciodt=0,5&hl=en",268,"2020-04-30 13:05:27","","","","",,,,,9,3.00,2,5,3,"Objective We introduce a method that quantifies the consistent involvement of intracranially monitored regions in recurrent focal seizures. Methods We evaluated the consistency of two ictal spectral activation patterns (mean power change and power change onset time) in …"
8,"AT Campo, A Principe, M Ley, R Rocamora…","Degenerate time-dependent network dynamics anticipate seizures in human epileptic brain",2018,"PLoS biology","journals.plos.org","https://journals.plos.org/plosbiology/article%3Fid%3D10.1371/journal.pbio.2002580","https://scholar.google.com/scholar?cites=17649556338918547877&as_sdt=2005&sciodt=0,5&hl=en",269,"2020-04-30 13:05:27","HTML","","","",,,,,8,4.00,2,5,2,"Epileptic seizures are known to follow specific changes in brain dynamics. While some algorithms can nowadays robustly detect these changes, a clear understanding of the mechanism by which these alterations occur and generate seizures is still lacking. Here, we …"
6,"G Deco, L Martignon","Method for detecting synchronicity between several digital measurement series with the aid of a computer",2000,"US Patent 6,134,510","Google Patents","https://patents.google.com/patent/US6134510A/en","https://scholar.google.com/scholar?cites=8346262713287082294&as_sdt=2005&sciodt=0,5&hl=en",270,"2020-04-30 13:05:27","","","","",,,,,6,0.30,3,2,20,"The method makes it possible to determine synchronicity of several measurement series which consist of binary frequency data, in order to detect redundancy between several neurons. In this case, every possible combination of synchronicity has its own occurrence …"
6,"G Deco, N Grün","Angular distribution of electron-positron pairs produced in ion-ion collisions at relativistic energies",1990,"Physics Letters A","Elsevier","https://www.sciencedirect.com/science/article/pii/0375960190903782","https://scholar.google.com/scholar?cites=6729063937004754561&as_sdt=2005&sciodt=0,5&hl=en",271,"2020-04-30 13:05:27","","","","",,,,,6,0.20,3,2,30,"For thecalculation ofthe production ofelectron—positron pairs in ion—ion collisions at high energies we have formulated a continuum distorted wave model. Angular distributions of the emitted leptons are shown and discussed … For the measurements of the production of e~—e—pairs with the …"
7,"S Atasoy, J Vohryzek, G Deco, RL Carhart-Harris…","Common neural signatures of psychedelics: frequency-specific energy changes and repertoire expansion revealed using connectome-harmonic decomposition",2018,"Progress in brain …","Elsevier","https://www.sciencedirect.com/science/article/pii/S0079612318301018","https://scholar.google.com/scholar?cites=15512188726835421450&as_sdt=2005&sciodt=0,5&hl=en",272,"2020-04-30 13:05:27","","","","",,,,,7,3.50,1,5,2,"The search for the universal laws of human brain function is still on-going but progress is being made. Here we describe the novel concepts of connectome harmonics and connectome-harmonic decomposition, which can be used to characterize the brain activity …"
6,"G Deco, ET Rolls","Neural mechanisms of visual memory: A neurocomputational perspective",2008,"Visual memory","books.google.com","https://books.google.com/books?hl=en&lr=&id=2VhnDAAAQBAJ&oi=fnd&pg=PA247&dq=%22gustavo+deco%22&ots=d3M6t5g4bB&sig=pjClYwncJoyZ6Ycbi37cHTAQ83E","https://scholar.google.com/scholar?cites=10302877783881437303&as_sdt=2005&sciodt=0,5&hl=en",273,"2020-04-30 13:05:27","","","","",,,,,6,0.50,3,2,12,"A number of cognitive neuroscience studies have shown that the prefrontal cortex (PFC) is involved in at least some types of working memory functions (Fuster, 2000; Goldman-Rakic, 1995; Goldman-Rakic, 1996; Goel & Grafman, 1995). Working memory refers to an active …"
